date,ticker,link,headline,neg,neu,pos,compound
2020-03-02,AAPL,https://www.investing.com/news/stock-market-news/wall-street-buys-the-dip-as-investors-bet-on-stimulus-2098533,Dow has biggest daily jump since 2009 as Wall Street buys the dip By Reuters,0.062,0.852,0.086,0.9306
2020-03-02,AAPL,https://www.investing.com/news/stock-market-news/us-stocks-higher-at-close-of-trade-dow-jones-industrial-average-up-509-2099204,U.S. stocks higher at close of trade; Dow Jones Industrial Average up 5.09% By Investing.com,0.053,0.9,0.047,-0.7184
2020-03-03,AAPL,https://www.investing.com/news/stock-market-news/foxconn-to-resume-normal-production-in-china-end-of-march-2099434,Virus to dent Foxconn's consumer electronics revenue in first-quarter By Reuters,0.068,0.8590000000000001,0.07200000000000001,-0.016
2020-03-03,AAPL,https://www.investing.com/news/economy/top-5-things-to-know-in-the-market-on-tuesday-march-3rd-2099544,"Top 5 Things to Know in the Market on Tuesday, March 3rd By Investing.com",0.045,0.887,0.068,0.9434
2020-03-03,AAPL,https://www.investing.com/news/stock-market-news/stocks--apple-rises-in-premarket-after-hon-hai-update-2099736,Stocks - Apple Rises in Premarket After Hon Hai Update By Investing.com,0.0,0.887,0.113,0.3182
2020-03-03,AAPL,https://www.investing.com/news/stock-market-news/stocks--wall-street-resumes-its-fall-at-opening-after-g7-dud-2099794,Stocks - Wall Street Resumes Its Fall at Opening After G7 Dud By Investing.com,0.049,0.83,0.122,0.9829
2020-03-03,AAPL,https://www.investing.com/news/economy/who-urges-containment-second-case-in-new-york-virus-update-2100053,WHO Urges Containment; Second Case in New York: Virus Update By Bloomberg,0.087,0.8540000000000001,0.059000000000000004,-0.9977
2020-03-03,AAPL,https://www.investing.com/news/forex-news/who-urges-containment-second-case-in-new-york-virus-update-2100052,WHO Urges Containment; Second Case in New York: Virus Update By Bloomberg,0.087,0.8540000000000001,0.059000000000000004,-0.9977
2020-03-03,AAPL,https://www.investing.com/news/stock-market-news/apple-stock-falls-4-2100209,Apple Stock Falls 4% By Investing.com,0.0,0.953,0.047,0.29600000000000004
2020-03-04,AAPL,https://www.investing.com/news/stock-market-news/stocks--nordstrom-hpe-fall-ge-rises-in-premarket-2100950,"Stocks - Nordstrom, HPE Fall, GE Rises in Premarket By Investing.com",0.0,0.887,0.113,0.3182
2020-03-04,AAPL,https://www.investing.com/news/technology-news/apple-supplier-skyworks-sees-no-big-production-hit-from-coronavirus-2100947,Apple supplier Skyworks cuts forecasts on supply chain hit By Reuters,0.07200000000000001,0.8540000000000001,0.07400000000000001,0.3582
2020-03-04,AAPL,https://www.investing.com/news/stock-market-news/apple-supply-chain-woes-may-fade-quicker-than-expected-nomura-says-2101326,"Apple Supply Chain Woes May Fade Quicker Than Expected, Nomura Says By Investing.com",0.025,0.836,0.139,0.9439
2020-03-04,AAPL,https://www.investing.com/news/economy/feds-economic-survey-set-to-offer-more-clues-on-coronavirus-impact-2100745,"U.S. businesses show growing concern over impact of coronavirus, Fed survey shows By Reuters",0.08,0.8909999999999999,0.028999999999999998,-0.977
2020-03-04,AAPL,https://www.investing.com/news/stock-market-news/apple-stock-rises-4-2101422,Apple Stock Rises 4% By Investing.com,0.0,0.953,0.047,0.29600000000000004
2020-03-05,AAPL,https://www.investing.com/news/technology-news/apple-pulls-out-of-south-by-southwest-festival-amid-coronavirus-outbreak-2101670,"Apple, Netflix pull out of South by Southwest festival amid coronavirus outbreak By Reuters",0.033,0.917,0.049,0.4767
2020-03-05,AAPL,https://www.investing.com/news/stock-market-news/stocks---europe-opens-under-pressure-as-virus-warnings-multiply-2101766,Stocks  - Europe Opens Under Pressure as Virus Warnings Multiply By Investing.com,0.10300000000000001,0.841,0.055999999999999994,-0.7906
2020-03-05,AAPL,https://www.investing.com/news/stock-market-news/india-plans-to-airlift-components-from-china-to-help-local-tech-industry-sources-2101779,India plans to airlift components from China to help local tech industry: sources By Reuters,0.057999999999999996,0.905,0.037000000000000005,-0.9501
2020-03-05,AAPL,https://www.investing.com/news/technology-news/facebook-confirms-contractor-in-seattle-diagnosed-with-coronavirus-2101739,"Amazon, Facebook ask Seattle employees to work from home over coronavirus fears By Reuters",0.059000000000000004,0.89,0.051,-0.7264
2020-03-06,AAPL,https://www.investing.com/news/technology-news/the-coronavirus-domino-effect-south-korean-tech-firms-reel-as-vietnam-links-curbed-2102668,The coronavirus domino effect: South Korean tech firms reel as Vietnam links curbed By Reuters,0.064,0.873,0.063,0.7272
2020-03-06,AAPL,https://www.investing.com/news/stock-market-news/how-lipper-awardwinning-fund-managers-are-playing-coronavirus-scare-2102905,How Lipper Award-winning fund managers are playing coronavirus scare By Reuters,0.03,0.84,0.13,0.9976
2020-03-06,AAPL,https://www.investing.com/news/stock-market-news/special-report--sleeping-beauty-how-suspect-gold-reached-top-brands-2102940,Special Report: Sleeping Beauty - How suspect gold reached top brands By Reuters,0.045,0.902,0.053,0.8292
2020-03-06,AAPL,https://www.investing.com/news/stock-market-news/stocks--dow-opens-down-740-points-as-virus-outweighs-jobs-report-2103267,Stocks - Dow Opens Down 740 Points as Virus Outweighs Jobs Report By Investing.com,0.111,0.85,0.039,-0.9813
2020-03-06,AAPL,https://www.investing.com/news/technology-news/apple-asks-silicon-valley-employees-to-work-from-home-as-virus-spreads-2103598,Apple asks Silicon Valley employees to work from home as virus spreads By Reuters,0.0,1.0,0.0,0.0
2020-03-06,AAPL,https://www.investing.com/news/economy/us-excludes-chinese-face-masks-medical-gear-from-tariffs-as-coronavirus-spreads-2103594,"U.S. excludes Chinese face masks, medical gear from tariffs as coronavirus spreads By Reuters",0.024,0.893,0.083,0.9209
2020-03-07,AAPL,https://www.investing.com/news/general/sxsw-canceled-as-tech-and-entertainment-world-faces-coronavirus-2103798,SXSW canceled as tech and entertainment world faces coronavirus By Reuters,0.076,0.825,0.099,0.5928
2020-03-08,AAPL,https://www.investing.com/news/stock-market-news/saudi-aramco-trades-below-ipo-price-for-first-time-2104037,"Aramco trades below IPO price for first time, after OPEC pact unravels By Reuters",0.083,0.8490000000000001,0.069,-0.8128
2020-03-08,AAPL,https://www.investing.com/news/stock-market-news/swatch-group-ceo-sees-massive-temporary-hit-in-china-from-coronavirus-2104058,Swatch Group CEO sees 'massive' temporary hit in China from coronavirus By Reuters,0.051,0.877,0.07200000000000001,0.8807
2020-03-09,AAPL,https://www.investing.com/news/economy/nations-seek-to-ease-economic-hit-deaths-at-3800-virus-update-2104394,"Nations Seek to Ease Economic Hit; Deaths at 3,800: Virus Update By Bloomberg",0.08900000000000001,0.848,0.063,-0.997
2020-03-09,AAPL,https://www.investing.com/news/forex-news/stocks--oil-sector-routed-in-premarket-as-saudi-declares-price-war-2104623,Stocks - Oil Sector Routed in Premarket as Saudi Declares Price War By Investing.com,0.0,0.887,0.113,0.3182
2020-03-09,AAPL,https://www.investing.com/news/stock-market-news/stocks--wall-street-trading-halted-at-open-as-rout-deepens-sp-7-2104683,Stocks - Wall Street Trading Halted at Open as Rout Deepens; S&P -7% By Investing.com,0.142,0.815,0.043,-0.9849
2020-03-09,AAPL,https://www.investing.com/news/stock-market-news/apple-sells-fewer-than-500000-smartphones-in-china-in-february-amid-coronavirus-2104515,"Apple sells fewer than 500,000 smartphones in China in February amid coronavirus By Reuters",0.085,0.897,0.018000000000000002,-0.95
2020-03-09,AAPL,https://www.investing.com/news/stock-market-news/stocks--dow-in-biggest-oneday-points-plunge-ever-as-bears-run-riot-2105282,Stocks - Dow in Biggest One-Day Points Plunge Ever as Bears Run Riot By Investing.com,0.177,0.748,0.075,-0.9923
2020-03-09,AAPL,https://www.investing.com/news/stock-market-news/coronavirus-then-oil-collapse-erase-5-trillion-from-us-stocks-2105288,"Coronavirus, oil collapse erase $5 trillion from U.S. stocks By Reuters",0.157,0.762,0.08199999999999999,-0.9912
2020-03-10,AAPL,https://www.investing.com/news/technology-news/samsung-display-asks-vietnam-not-to-quarantine-700-engineers-from-virushit-south-korea-2105575,Samsung Display asks Vietnam not to quarantine 700 engineers from virus-hit South Korea By Reuters,0.0,0.958,0.042,0.4767
2020-03-10,AAPL,https://www.investing.com/news/technology-news/in-malaysias-silicon-valley-fortunes-flip-as-virus-wrecks-trade-war-gains-2105584,"In Malaysia's Silicon Valley, fortunes flip as virus wrecks trade war gains By Reuters",0.05,0.919,0.031,-0.9284
2020-03-10,AAPL,https://www.investing.com/news/stock-market-news/chinas-new-cases-slow-xi-visits-wuhan-virus-update-2105589,China’s New Cases Slow; Xi Visits Wuhan: Virus Update By Bloomberg,0.065,0.884,0.051,-0.9844
2020-03-10,AAPL,https://www.investing.com/news/technology-news/coronavirus-detected-at-apples-european-hq-in-ireland-2105928,"Coronavirus case at Apple's Irish HQ, Trinity College goes online By Reuters",0.025,0.8909999999999999,0.084,0.9568
2020-03-10,AAPL,https://www.investing.com/news/stock-market-news/stocks--dow-turns-positive-as-wild-swings-on-wall-street-continue-2106260,Stocks - Wall Street Rallies Into Late Trading By Investing.com,0.076,0.818,0.107,0.882
2020-03-10,AAPL,https://www.investing.com/news/technology-news/intel-says-flawed-eu-antitrust-decision-underpins-12-billion-fine-2105797,Intel says flawed EU antitrust decision underpins $1.2 billion fine By Reuters,0.083,0.8270000000000001,0.09,0.2294
2020-03-10,AAPL,https://www.investing.com/news/cryptocurrency-news/braves-bat-rewards-can-now-be-redeemed-at-amazon-apple-and-netflix-2106480,"Brave’s BAT Rewards Can Now be Redeemed at Amazon, Apple and Netflix By Cointelegraph",0.0,0.825,0.175,0.9201
2020-03-10,AAPL,https://www.investing.com/news/stock-market-news/us-stocks-higher-at-close-of-trade-dow-jones-industrial-average-up-489-2106607,U.S. stocks higher at close of trade; Dow Jones Industrial Average up 4.89% By Investing.com,0.049,0.8909999999999999,0.06,0.2732
2020-03-11,AAPL,https://www.investing.com/news/technology-news/white-house-to-meet-large-tech-companies-to-discuss-ways-to-control-coronavirus-outbreak-2106657,White House to meet large tech companies to discuss ways to control coronavirus outbreak By Reuters,0.049,0.935,0.016,-0.6705
2020-03-11,AAPL,https://www.investing.com/news/stock-market-news/stockbeat-adidas-plummets-after-grim-china-sales-update-2106839,StockBeat: Adidas Plummets After Grim China Sales Update By Investing.com,0.078,0.846,0.076,-0.2764
2020-03-11,AAPL,https://www.investing.com/news/stock-market-news/us-senator-calls-for-action-on-forced-labor-in-chinas-xinjiang-2106576,U.S. senator calls for action on forced labor in China's Xinjiang By Reuters,0.16399999999999998,0.8170000000000001,0.019,-0.9947
2020-03-11,AAPL,https://www.investing.com/news/stock-market-news/goldman-manager-says-virus-hit-may-be-worse-than-market-expects-2107199,Goldman Manager Says Virus Hit May Be Worse Than Market Expects By Bloomberg,0.10300000000000001,0.81,0.087,-0.9008
2020-03-11,AAPL,https://www.investing.com/news/technology-news/white-house-tech-industry-meet-to-discuss-coronavirus-response-2107552,"White House, tech industry meet to discuss coronavirus response By Reuters",0.073,0.8320000000000001,0.095,0.7506
2020-03-11,AAPL,https://www.investing.com/news/economy/explainer-coronavirus-fears-hit-the-market-hard-how-much-did-ordinary-americans-lose-2106896,Explainer: Coronavirus fears hit the market hard. How much did ordinary Americans lose? By Reuters,0.063,0.873,0.065,0.5967
2020-03-11,AAPL,https://www.investing.com/news/stock-market-news/apple-stock-falls-4-2107612,Apple Stock Falls 4% By Investing.com,0.0,0.953,0.047,0.29600000000000004
2020-03-12,AAPL,https://www.investing.com/news/world-news/hong-kong-dismisses-us-criticism-over-human-rights-2107957,Hong Kong dismisses U.S. criticism over human rights By Reuters,0.091,0.8029999999999999,0.106,0.8338
2020-03-12,AAPL,https://www.investing.com/news/general/apple-signs-multiyear-deals-with-major-music-labels-financial-times-2108746,Apple signs multi-year deals with major music labels: Financial Times By Reuters,0.033,0.8740000000000001,0.094,0.5956
2020-03-12,AAPL,https://www.investing.com/news/technology-news/french-watchdog-set-to-fine-apple-over-anticompetitive-behavior-sources-2108747,"French watchdog to fine Apple over anti-competitive behaviour, sources say By Reuters",0.054000000000000006,0.888,0.057999999999999996,-0.6369
2020-03-12,AAPL,https://www.investing.com/news/stock-market-news/apple-stock-falls-8-2108841,Apple Stock Falls 8% By Investing.com,0.0,0.953,0.047,0.29600000000000004
2020-03-12,AAPL,https://www.investing.com/news/technology-news/broadcom-withdraws-2020-revenue-forecast-on-coronavirus-hit-2108940,Broadcom withdraws 2020 revenue forecast on coronavirus worries By Reuters,0.054000000000000006,0.8640000000000001,0.08199999999999999,0.8554
2020-03-13,AAPL,https://www.investing.com/news/technology-news/apple-reopens-all-its-branded-stores-in-china-2109111,Apple says reopening all its branded stores in China By Reuters,0.026000000000000002,0.934,0.040999999999999995,0.4939
2020-03-13,AAPL,https://www.investing.com/news/cryptocurrency-news/mew-app-allows-you-to-buy-crypto-instantly--but-theres-a-catch-2109231,MEW App Allows You to Buy Crypto Instantly — But There’s a Catch By Cointelegraph,0.10400000000000001,0.828,0.068,0.0147
2020-03-13,AAPL,https://www.investing.com/news/stock-market-news/buffettbacked-chinese-ev-maker-byd-says-making-5-million-masks-daily-to-fight-virus-2109298,Buffett-backed Chinese EV maker BYD says making 5 million masks daily to fight virus By Reuters,0.08,0.87,0.05,-0.836
2020-03-13,AAPL,https://www.investing.com/news/forex-news/stocks-rebound-in-premarket-apple-disney-2109595,"Stocks Rebound in Premarket; Apple, Disney, Softbank All Rise By Investing.com",0.075,0.925,0.0,-0.2732
2020-03-13,AAPL,https://www.investing.com/news/stock-market-news/apple-stock-rises-7-2109640,Apple Stock Rises 7% By Investing.com,0.0,0.953,0.047,0.29600000000000004
2020-03-13,AAPL,https://www.investing.com/news/stock-market-news/stocks--wall-street-bounces-at-open-on-europe-lift-dow-up-over-1000-points-2109664,Stocks - Wall Street Bounces at Open on Europe Lift: Dow up Over 1000 Points By Investing.com,0.063,0.8759999999999999,0.061,-0.3753
2020-03-13,AAPL,https://www.investing.com/news/technology-news/apple-shifts-annual-developers-conference-to-onlineonly-format-2109927,Apple shifts annual developers conference to online-only format By Reuters,0.071,0.895,0.034,-0.6597
2020-03-13,AAPL,https://www.investing.com/news/stock-market-news/att-asks-employees-to-work-from-home-amid-virus-fears-2110022,AT&T asks employees to work from home amid virus fears By Reuters,0.033,0.877,0.09,0.5994
2020-03-13,AAPL,https://www.investing.com/news/stock-market-news/wall-street-bounces-after-worst-day-since-1987-2109492,Stocks bounce on stimulus hopes By Reuters,0.065,0.8490000000000001,0.086,0.8931
2020-03-14,AAPL,https://www.investing.com/news/economy/world-closes-borders-restricts-travel-to-contain-coronavirus-spread-2110413,"World closes borders, restricts travel to contain coronavirus spread By Reuters",0.10400000000000001,0.8590000000000001,0.037000000000000005,-0.9952
2020-03-14,AAPL,https://www.investing.com/news/stock-market-news/india-hikes-taxes-on-mobile-phones-parts-2110540,"India hikes taxes on mobile phones, parts By Reuters",0.0,0.9440000000000001,0.055999999999999994,0.5994
2020-03-14,AAPL,https://www.investing.com/news/technology-news/apple-to-close-retail-stores-outside-greater-china-until-march-27-2110411,"Apple to close retail stores worldwide, except Greater China, Verizon to close some U.S. stores By Reuters",0.05,0.86,0.09,0.8442
2020-03-15,AAPL,https://www.investing.com/news/commodities-news/saudi-aramcos-2019-profit-down-21-on-weak-oil-price-2110674,Aramco to cut capital spending over coronavirus; 2019 profits plunge By Reuters,0.052000000000000005,0.87,0.079,0.9555
2020-03-15,AAPL,https://www.investing.com/news/stock-market-news/oil-giants-set-workathome-rules-for-offices-health-checks-for-critical-staff-2110779,"Oil giants set health checks for critical staff, work-from-home rules By Reuters",0.059000000000000004,0.907,0.034,-0.9182
2020-03-16,AAPL,https://www.investing.com/news/stock-market-news/gambling-limitations-elderly-shopping-hours-coronavirus-changes-business-2111137,"Gambling limitations, elderly shopping hours; coronavirus changes business By Reuters",0.043,0.915,0.040999999999999995,-0.629
2020-03-16,AAPL,https://www.investing.com/news/stock-market-news/treasuries-soar-sp-500-futures-hit-limitdown-markets-wrap-2111174,"Treasuries Soar, S&P 500 Futures Hit Limit-Down: Markets Wrap By Bloomberg",0.061,0.8440000000000001,0.095,0.9022
2020-03-16,AAPL,https://www.investing.com/news/stock-market-news/stocks--us-futures-suspended-limit-down-despite-fed-moves-2111295,Stocks - U.S. Futures Suspended Limit Down Despite Fed Moves By Investing.com,0.124,0.809,0.067,-0.9705
2020-03-16,AAPL,https://www.investing.com/news/technology-news/french-antitrust-body-fines-apple-11-billion-euros-for-anticompetitive-behaviour-2111248,French antitrust regulator fines Apple $1.2 billion By Reuters,0.049,0.888,0.063,0.4222
2020-03-16,AAPL,https://www.investing.com/news/stock-market-news/stocks--almost-everything-down-in-premarket-banks-airlines-hit-2111398,"Stocks - Almost Everything Down in Premarket; Banks, Airlines Hit By Investing.com",0.152,0.7829999999999999,0.065,-0.9231
2020-03-16,AAPL,https://www.investing.com/news/stock-market-news/stocks--wall-street-sees-worst-drop-since-1987-as-fed-fails-to-stop-panic-2111509,Stocks - Wall Street Sees Worst Drop Since 1987 as Fed Fails to Stop Panic By Investing.com,0.09699999999999999,0.858,0.044000000000000004,-0.9816
2020-03-16,AAPL,https://www.investing.com/news/stock-market-news/factbox-retailers-close-stores-around-globe-to-curb-coronavirus-spread-2111697,Factbox: Retailers close stores around globe to curb coronavirus spread By Reuters,0.025,0.9440000000000001,0.032,0.1531
2020-03-16,AAPL,https://www.investing.com/news/forex-news/wall-street-off-lows-but-sea-of-red-continues-as-federal-reserve-steps-in-again-2111782,"Stocks - Wall Street off Lows, but Sea of Red Continues as Fed Steps in Again By Investing.com",0.085,0.873,0.042,-0.8395
2020-03-16,AAPL,https://www.investing.com/news/stock-market-news/stocks--dow-plunges-3000-points-trump-says-virus-could-last-until-august-2112015,"Stocks - Dow Plunges 3,000 Points, Trump Says Virus Could Last Until August By Investing.com",0.096,0.84,0.064,-0.765
2020-03-17,AAPL,https://www.investing.com/news/economy/taiwan-central-bank-seen-cutting-rates-as-pandemic-hits-growth-reuters-poll-2112314,Taiwan central bank seen cutting rates as pandemic hits growth: Reuters poll By Reuters,0.106,0.8590000000000001,0.034,-0.9638
2020-03-17,AAPL,https://www.investing.com/news/technology-news/us-trade-body-opens-patent-probe-after-complaint-by-irelands-neodron-2112173,U.S. trade body opens patent probe after complaint by Ireland's Neodron By Reuters,0.08,0.909,0.011000000000000001,-0.8225
2020-03-17,AAPL,https://www.investing.com/news/cryptocurrency-news/opera-browser-enables-apple-pay-and-debit-card-crypto-purchases-in-the-us-2112485,Opera Browser Enables Apple Pay and Debit Card Crypto Purchases in the US By Cointelegraph,0.02,0.98,0.0,-0.1027
2020-03-17,AAPL,https://www.investing.com/news/stock-market-news/apple-stock-rises-4-2112984,Apple Stock Rises 4% By Investing.com,0.0,0.953,0.047,0.29600000000000004
2020-03-17,AAPL,https://www.investing.com/news/technology-news/apple-closes-us-retail-stores-until-further-notice-2113088,"Apple closes all retail stores, except Greater China, until further notice By Reuters",0.0,0.9470000000000001,0.053,0.3612
2020-03-18,AAPL,https://www.investing.com/news/technology-news/exclusive-amazon-stops-receiving-nonessential-products-from-sellers-amid-coronavirus-outbreak-2112905,"Amazon warehouses receive only vital supplies in U.S., Europe amid coronavirus By Reuters",0.071,0.868,0.061,0.3645
2020-03-18,AAPL,https://www.investing.com/news/technology-news/apple-brings-back-scissor-keyboards-in-latest-macbook-air-2114222,Apple brings back 'scissor' keyboards in latest MacBook Air By Reuters,0.127,0.835,0.037000000000000005,-0.8781
2020-03-18,AAPL,https://www.investing.com/news/economy/as-chinas-coronavirus-outbreak-eases-a-wary-return-to-shops-for-consumers-2113596,"As China's coronavirus outbreak eases, a wary return to shops for consumers By Reuters",0.064,0.863,0.073,0.8506
2020-03-19,AAPL,https://www.investing.com/news/general/nfl-notebook-bears-acquire-foles-from-jaguars-2114897,NFL notebook: Bears acquire Foles from Jaguars By Reuters,0.013000000000000001,0.898,0.08900000000000001,0.9944
2020-03-19,AAPL,https://www.investing.com/news/stock-market-news/teslas-musk-offers-to-make-ventilators-amid-shortage-in-coronavirus-battle-2114957,Tesla's Musk offers to make ventilators amid shortage in coronavirus battle By Reuters,0.069,0.826,0.105,0.91
2020-03-19,AAPL,https://www.investing.com/news/technology-news/google-exploring-using-location-info-to-slow-coronavirus-spread-2115947,Google exploring using location info to slow coronavirus spread By Reuters,0.021,0.934,0.045,0.752
2020-03-19,AAPL,https://www.investing.com/news/stock-market-news/dow-rebounds-as-energy-rides-oil-surge-higher--but-virus-spread-curbs-gains-2115988,"Dow Rebounds as Energy Rides Oil Surge Higher,  but Virus Spread Curbs Gains By Investing.com",0.128,0.7759999999999999,0.096,-0.7003
2020-03-20,AAPL,https://www.investing.com/news/world-news/apple-limits-online-iphone-purchases-to-two-per-person-amid-coronavirus-2116324,Apple limits online iPhone purchases to two per person amid coronavirus By Reuters,0.063,0.9109999999999999,0.026000000000000002,-0.9383
2020-03-20,AAPL,https://www.investing.com/news/coronavirus/singapore-launches-contact-tracing-mobile-app-to-track-coronavirus-infections-2116693,Singapore launches contact tracing mobile app to track coronavirus infections By Reuters,0.051,0.871,0.077,0.8074
2020-03-20,AAPL,https://www.investing.com/news/stock-market-news/apple-stock-falls-4-2117227,Apple Stock Falls 4% By Investing.com,0.0,0.953,0.047,0.29600000000000004
2020-03-20,AAPL,https://www.investing.com/news/coronavirus/google-cancels-annual-developer-conference-on-coronavirus-fears-2117320,Google cancels annual developer conference on coronavirus fears By Reuters,0.175,0.825,0.0,-0.8834
2020-03-21,AAPL,https://www.investing.com/news/coronavirus/google-exploring-using-location-info-to-slow-coronavirus-spread-2117487,Google exploring using location info to slow coronavirus spread By Reuters,0.021,0.934,0.045,0.752
2020-03-22,AAPL,https://www.investing.com/news/coronavirus/google-exploring-using-location-info-to-slow-coronavirus-spread-2117750,Google exploring using location info to slow coronavirus spread By Reuters,0.021,0.934,0.045,0.752
2020-03-23,AAPL,https://www.investing.com/news/stock-market-news/apple-scraps-curbs-on-online-buyers-of-iphones-amid-virus-outbreak-2118273,Apple scraps curbs on online buyers of iPhones amid virus outbreak By Reuters,0.0,0.953,0.047,0.5719
2020-03-23,AAPL,https://www.investing.com/news/stock-market-news/stocks--us-futures-head-lower-as-stimulus-bill-falters-2118379,Stocks - U.S. Futures Head Lower as Stimulus Bill Falters By Investing.com,0.087,0.861,0.052000000000000005,-0.8689
2020-03-23,AAPL,https://www.investing.com/news/coronavirus/ireland-cannot-tap-apple-tax-fund-for-coronavirus-fight-pm-says-2118506,"Ireland cannot tap Apple tax fund for coronavirus fight, PM says By Reuters",0.1,0.8340000000000001,0.066,-0.875
2020-03-23,AAPL,https://www.investing.com/news/stock-market-news/apples-value-drops-below-1-trillion-while-microsoft-holds-on-2118766,"Apple’s Value Drops Below $1 Trillion, While Microsoft Holds On By Bloomberg",0.07400000000000001,0.8420000000000001,0.084,0.0772
2020-03-23,AAPL,https://www.investing.com/news/stock-market-news/us-trade-regulators-approve-tariff-exemption-for-apple-watches-2119005,U.S. trade regulators approve tariff exemption for Apple Watches By Reuters,0.048,0.848,0.10300000000000001,0.802
2020-03-24,AAPL,https://www.investing.com/news/stock-market-news/apple-expects-to-start-reopening-some-stores-in-first-half-of-april-bloomberg-news-2120307,Apple expects to start reopening some stores in first half of April: Bloomberg News By Reuters,0.039,0.919,0.042,0.0813
2020-03-25,AAPL,https://www.investing.com/news/stock-market-news/iphone-makers-suspend-india-production-due-to-lockdown-2120643,iPhone Makers Suspend India Production Due to Lockdown By Bloomberg,0.035,0.9420000000000001,0.023,-0.6249
2020-03-25,AAPL,https://www.investing.com/news/stock-market-news/stocks--airlines-boeing-surge-in-premarket-as-bailout-package-looms-2121016,"Stocks - Airlines, Boeing Surge in Premarket as Bailout Package Looms By Investing.com",0.0,1.0,0.0,0.0
2020-03-25,AAPL,https://www.investing.com/news/stock-market-news/stocks--dow-cuts-gains-as-jostling-on-capitol-hill-threatens-stimulus-delay-2121579,Stocks - Dow Cuts Gains as Jostling on Capitol Hill Threatens Stimulus Delay By Investing.com,0.09300000000000001,0.823,0.085,-0.0818
2020-03-26,AAPL,https://www.investing.com/news/technology-news/micron-forecasts-revenue-above-estimates-sees-surge-in-data-center-demand-2121663,Micron sees revenue above estimates as demand rises for remote-work devices By Reuters,0.064,0.875,0.061,0.4767
