date,ticker,link,headline,neg,neu,pos,compound
2020-05-08,AAPL,https://www.investing.com/news/coronavirus/indian-court-seeks-government-reply-over-challenge-to-mandatory-coronavirus-app-2165523,Indian court seeks government reply over challenge to mandatory coronavirus app By Reuters,0.016,0.93,0.054000000000000006,0.8922
2020-05-08,AAPL,https://www.investing.com/news/stock-market-news/exclusive-jc-penney-to-file-for-bankruptcy-as-soon-as-next-week-sources-say-2165783,"Exclusive: J.C. Penney to file for bankruptcy as soon as next week, sources say By Reuters",0.040999999999999995,0.914,0.045,0.4003
2020-05-08,AAPL,https://www.investing.com/news/technology-news/eu-looks-for-evidence-to-rein-in-us-tech-giants-2166087,EU looks for evidence to rein in U.S. tech giants By Reuters,0.034,0.8959999999999999,0.07,0.8945
2020-05-08,AAPL,https://www.investing.com/news/stock-market-news/stocks--dow-rallies-to-snap-twoweek-losing-streak-amid-bets-on-jobs-comeback-2166240,Stocks - Dow Rallies to Snap Two-Week Losing Streak Amid Bets on Jobs Comeback By Investing.com,0.052000000000000005,0.871,0.077,0.922
2020-05-08,AAPL,https://www.investing.com/news/coronavirus/who-readies-coronavirus-app-for-checking-symptoms-possibly-contact-tracing-2166242,"WHO readies coronavirus app for checking symptoms, possibly contact tracing By Reuters",0.023,0.91,0.067,0.9785
2020-05-08,AAPL,https://www.investing.com/news/technology-news/apple-to-reopen-some-stores-in-united-states-next-week-2166204,Apple to reopen some stores in United States next week By Reuters,0.0,0.932,0.068,0.9769
2020-05-08,AAPL,https://www.investing.com/news/stock-market-news/pointcounterpoint-us-stock-bulls-vs-bears-2166318,Point/Counterpoint: U.S. Stock Bulls Vs. Bears By Investing.com,0.062,0.8640000000000001,0.07400000000000001,0.8699
2020-05-10,AAPL,https://www.investing.com/news/commodities-news/the-car-is-staging-a-comeback-spurring-oils-recovery-2167427,"The Car Is Staging a Comeback, Spurring Oil’s Recovery By Bloomberg",0.045,0.875,0.08,0.9909
2020-05-11,AAPL,https://www.investing.com/news/technology-news/washington-in-talks-with-chipmakers-about-building-us-factories-wsj-2167206,Washington in talks with chipmakers about building U.S. factories By Reuters,0.036000000000000004,0.847,0.11599999999999999,0.9839
2020-05-11,AAPL,https://www.investing.com/news/stock-market-news/us-stocks-mixed-at-close-of-trade-dow-jones-industrial-average-down-045-2168610,U.S. stocks mixed at close of trade; Dow Jones Industrial Average down 0.45% By Investing.com,0.067,0.865,0.068,-0.4019
2020-05-12,AAPL,https://www.investing.com/news/technology-news/smartphone-shipments-in-china-up-17-in-april-signalling-likely-rebound-government-data-2168976,"Smartphone shipments in China up 17% in April, signalling likely rebound: government data By Reuters",0.019,0.981,0.0,-0.4767
2020-05-13,AAPL,https://www.investing.com/news/stock-market-news/sony-reports-57-drop-in-fourthquarter-profit-declines-to-give-outlook-2170406,"Sony braces for lowest profit in four years, hit broadly by coronavirus By Reuters",0.057999999999999996,0.828,0.115,0.9849
2020-05-13,AAPL,https://www.investing.com/news/world-news/swiss-doctor-taps-his-past-to-help-zurich-meet-ppe-needs-2170849,Swiss doctor taps his past to help Zurich meet PPE needs By Reuters,0.044000000000000004,0.878,0.078,0.9645
2020-05-13,AAPL,https://www.investing.com/news/technology-news/eu-consumer-group-warns-against-gamechanger-googlefitbit-deal-2170958,EU consumer group warns against 'game-changer' Google-Fitbit deal By Reuters,0.051,0.875,0.075,0.775
2020-05-13,AAPL,https://www.investing.com/news/technology-news/use-of-virustracing-apps-should-be-voluntary-eu-document-2170491,EU urges voluntary use of virus-tracing apps to speed recovery from pandemic By Reuters,0.071,0.852,0.076,-0.0516
2020-05-13,AAPL,https://www.investing.com/news/technology-news/amazon-launches-three-new-models-of-fire-tablet-2170963,Amazon launches three new models of Fire tablet By Reuters,0.171,0.703,0.126,-0.7506
2020-05-13,AAPL,https://www.investing.com/news/coronavirus/in-canada-albertans-wary-of-big-brother-with-use-of-covid19-digitaltracing-app-2171006,"In Canada, Albertans wary of 'Big Brother' with use of COVID-19 digital-tracing app By Reuters",0.047,0.887,0.066,0.7543
2020-05-13,AAPL,https://www.investing.com/news/stock-market-news/exclusive-europe-nears-crisis-plan-for-public-stakes-in-key-companies--sources-2171028,Exclusive: Europe nears crisis plan for public stakes in key companies - sources By Reuters,0.065,0.821,0.113,0.9888
2020-05-13,AAPL,https://www.investing.com/news/technology-news/shares-of-sensor-maker-ams-dive-after-proposes-capital-hike-2171019,Shares of sensor maker AMS dive after proposes capital hike By Reuters,0.021,0.889,0.09,0.9144
2020-05-14,AAPL,https://www.investing.com/news/technology-news/chip-specialist-atss-fullyear-core-profit-down-22-on-expansion-cost-2171745,Chip specialist AT&S's full-year core profit down 22% on expansion cost By Reuters,0.0,0.914,0.086,0.8481
2020-05-14,AAPL,https://www.investing.com/news/technology-news/india-launches-contacttracing-app-for-jiophones-in-virus-battle-2171788,India launches contact-tracing app for JioPhones in virus battle By Reuters,0.027999999999999997,0.912,0.061,0.5574
2020-05-14,AAPL,https://www.investing.com/news/coronavirus/india-follows-chinas-lead-to-widen-use-of-coronavirus-tracing-app-2171819,India follows China's lead to widen use of coronavirus tracing app By Reuters,0.048,0.898,0.054000000000000006,0.1771
2020-05-14,AAPL,https://www.investing.com/news/stock-market-news/stocks--wall-street-opens-lower-as-jobless-claims-stay-stubbornly-high-2172215,Stocks - Wall Street Opens Lower as Jobless Claims Stay Stubbornly High By Investing.com,0.10400000000000001,0.861,0.035,-0.9867
2020-05-14,AAPL,https://www.investing.com/news/economy/trump-threatens-new-taxes-on-companies-that-make-goods-outside-united-states-2172366,Trump threatens new taxes on companies that make goods outside United States By Reuters,0.105,0.821,0.07400000000000001,-0.9022
2020-05-14,AAPL,https://www.investing.com/news/economy/trump-threatens-new-taxes-on-companies-that-make-goods-outside-united-states-2172365,Trump threatens new taxes on companies that make goods outside United States By Reuters,0.105,0.821,0.07400000000000001,-0.9022
2020-05-14,AAPL,https://www.investing.com/news/coronavirus/factbox-the-race-to-deploy-covid19-contact-tracing-apps-2172387,Factbox: The race to deploy COVID-19 contact tracing apps By Reuters,0.048,0.87,0.08199999999999999,0.9762
2020-05-15,AAPL,https://www.investing.com/news/world-news/pompeo-says-tsmcs-12-billion-investment-to-increase-us-economic-independence-from-china-2173074,Pompeo says TSMC's $12 billion investment to increase U.S. economic independence from China By Reuters,0.054000000000000006,0.83,0.11599999999999999,0.7845
2020-05-15,AAPL,https://www.investing.com/news/stock-market-news/taiwan-semiconductor-to-announce-plans-for-us-factory-2172696,Taiwan's TSMC to build Arizona chip plant as U.S.-China tech rivalry escalates By Reuters,0.031,0.855,0.114,0.9954
2020-05-15,AAPL,https://www.investing.com/news/stock-market-news/iphone-maker-hon-hais-profit-dives-89-in-virushit-quarter-2173134,IPhone Maker Hon Hai’s Profit Dives 89% in Virus-Hit Quarter By Bloomberg,0.065,0.897,0.038,-0.7937
2020-05-15,AAPL,https://www.investing.com/news/coronavirus/foxconns-firstquarter-profit-tumbles-almost-90-on-coronavirus-fallout-2173124,"Foxconn quarterly profit hits two-decade low, sees growth from post-virus lifestyles By Reuters",0.083,0.84,0.078,0.1768
2020-05-15,AAPL,https://www.investing.com/news/technology-news/china-ready-to-put-apple-other-us-companies-in-unreliable-entity-list-global-times-2173462,"China ready to put Apple, other U.S. companies in 'unreliable entity list': Global Times By Reuters",0.028999999999999998,0.8909999999999999,0.08,0.7783
2020-05-15,AAPL,https://www.investing.com/news/stock-market-news/stocks--wall-street-opens-lower-on-trade-tension-dismal-retail-numbers-2173560,"Stocks - Wall Street Opens Lower on Trade Tension, Dismal Retail Numbers By Investing.com",0.12,0.841,0.04,-0.9911
2020-05-15,AAPL,https://www.investing.com/news/stock-market-news/apple-to-reopen-10-of-17-retail-stores-in-italy-next-week-2173848,Apple to Reopen 10 of 17 Retail Stores in Italy Next Week By Bloomberg,0.027000000000000003,0.89,0.083,0.8859999999999999
2020-05-15,AAPL,https://www.investing.com/news/stock-market-news/stocks--wall-street-makes-comeback-but-still-suffers-worst-week-since-march-2174069,"Stocks - Wall Street Makes Comeback, but Still Suffers Worst Week Since March By Investing.com",0.142,0.759,0.1,-0.9489
2020-05-15,AAPL,https://www.investing.com/news/stock-market-news/futures-edge-higher-on-china-industrial-data-2173351,"Wall Street ends up after swings on reopening hopes, weak data, trade woes By Reuters",0.10400000000000001,0.823,0.073,-0.9477
2020-05-15,AAPL,https://www.investing.com/news/technology-news/us-moves-to-cut-huawei-off-from-global-chip-suppliers-2173329,U.S. moves to cut Huawei off from global chip suppliers as China eyes retaliation By Reuters,0.052000000000000005,0.877,0.071,0.8266
2020-05-15,AAPL,https://www.investing.com/news/stock-market-news/us-funds-rush-to-tech-companies-and-battered-energy-stocks-in-firstquarter-2174172,U.S. funds rush to tech companies and battered energy stocks in first-quarter By Reuters,0.068,0.828,0.10400000000000001,0.9571
2020-05-15,AAPL,https://www.investing.com/news/stock-market-news/buffetts-berkshire-slashes-goldman-stake-exits-phillips-66-travelers-2174213,"Buffett's Berkshire slashes Goldman stake; exits Phillips 66, Travelers By Reuters",0.055999999999999994,0.867,0.077,0.7697
2020-05-16,AAPL,https://www.investing.com/news/technology-news/justice-department-state-ags-likely-to-bring-antitrust-lawsuits-against-google-wsj-2174092,U.S. state attorneys general likely to bring antitrust lawsuits against Google -source By Reuters,0.032,0.9009999999999999,0.067,0.9274
2020-05-16,AAPL,https://www.investing.com/news/stock-market-news/jc-penney-files-for-bankruptcy-protection-2174223,J.C. Penney files for bankruptcy protection By Reuters,0.063,0.8809999999999999,0.057,-0.836
2020-05-18,AAPL,https://www.investing.com/news/stock-market-news/global-chipmaking-kingpin-gets-dragged-into-uschina-trade-war-2174958,Global Chipmaking Kingpin Gets Dragged into U.S.-China Trade War By Bloomberg,0.076,0.782,0.14300000000000002,0.9981
2020-05-18,AAPL,https://www.investing.com/news/stock-market-news/apple-reopening-25-more-us-stores-will-soon-top-100-worldwide-2174921,"Apple reopening 25 more U.S. stores, will soon top 100 worldwide By Reuters",0.017,0.905,0.078,0.9393
2020-05-18,AAPL,https://www.investing.com/news/stock-market-news/stocks--us-futures-higher-more-stimulus-expected-2175261,Stocks - U.S. Futures Higher; More Stimulus Expected By Investing.com,0.037000000000000005,0.919,0.044000000000000004,0.5423
2020-05-18,AAPL,https://www.investing.com/news/stock-market-news/futures-cheered-by-lifting-of-virusrelated-curbs-2175302,Futures cheered by lifting of virus-related curbs By Reuters,0.040999999999999995,0.8540000000000001,0.10400000000000001,0.9559
2020-05-18,AAPL,https://www.investing.com/news/world-news/fbi-finds-evidence-of-al-qaeda-tie-to-2019-florida-naval-base-shooting-us-source-2175560,"FBI phone probe links al Qaeda to Saudi who killed 3 at Florida base, Barr says By Reuters",0.11800000000000001,0.8420000000000001,0.04,-0.9857
2020-05-18,AAPL,https://www.investing.com/news/stock-market-news/driving-energy-and-food-europes-reawakening-in-numbers-2176206,"Driving, Energy and Food: Europe’s Reawakening in Numbers By Bloomberg",0.07400000000000001,0.8759999999999999,0.05,-0.9024
2020-05-19,AAPL,https://www.investing.com/news/technology-news/japans-sharp-reports-37-profit-drop-gives-no-forecasts-2176371,"Japan's Sharp reports 37% profit drop, gives no forecasts By Reuters",0.064,0.8340000000000001,0.102,0.6249
2020-05-19,AAPL,https://www.investing.com/news/stock-market-news/sony-to-turn-financial-arm-into-wholly-owned-unit-for-37-billion-nikkei-2176320,Sony to take full control of listed financial arm for $3.7 billion By Reuters,0.009000000000000001,0.853,0.138,0.9905
2020-05-19,AAPL,https://www.investing.com/news/technology-news/white-house-panel-build-new-tech-infrastructure-for-future-jobs-2176297,White House panel: Build new tech infrastructure for future jobs By Reuters,0.064,0.804,0.132,0.9768
2020-05-19,AAPL,https://www.investing.com/news/technology-news/elderly-home-turns-to-wearables-for-contact-tracing-sidestepping-applegoogle-limits-2177245,"Elderly home turns to wearables for contact tracing, sidestepping Apple-Google limits By Reuters",0.021,0.902,0.077,0.9865
2020-05-19,AAPL,https://www.investing.com/news/technology-news/spotify-new-home-for-joe-rogans-podcast-shares-jump-2177364,"Spotify new home for Joe Rogan's podcast, shares jump By Reuters",0.0,0.9079999999999999,0.092,0.9489
2020-05-20,AAPL,https://www.investing.com/news/politics/senate-democrats-call-for-trump-administration-to-unveil-details-of-tsmc-plant-deal-2177576,Senate Democrats call for Trump administration to unveil details of TSMC plant deal By Reuters,0.023,0.912,0.065,0.8957
2020-05-20,AAPL,https://www.investing.com/news/economy/eu-must-focus-on-health-jobs-worry-about-fiscal-sustainability-later-commission-2177786,"EU must focus on health, jobs, worry about fiscal sustainability later: Commission By Reuters",0.067,0.853,0.08,0.5327
2020-05-20,AAPL,https://www.investing.com/news/technology-news/factbox-where-do-trump-and-biden-stand-on-tech-policy-issues-2177965,Factbox: Where do Trump and Biden stand on tech policy issues? By Reuters,0.068,0.8640000000000001,0.068,0.1307
2020-05-20,AAPL,https://www.investing.com/news/technology-news/hbo-max-announces-more-launch-partners-no-deals-yet-with-amazon-comcast-roku-2178355,"HBO Max announces more launch partners; no deals yet with Amazon, Comcast, Roku By Reuters",0.006999999999999999,0.938,0.055,0.9081
2020-05-20,AAPL,https://www.investing.com/news/coronavirus/a-nurse-struggled-with-covid19-trauma-he-was-found-dead-in-his-car-2177913,A nurse struggled with COVID-19 trauma. He was found dead in his car By Reuters,0.125,0.782,0.09300000000000001,-0.9944
2020-05-20,AAPL,https://www.investing.com/news/stock-market-news/chinas-got-a-new-plan-to-seize-the-worlds-tech-crown-from-the-us-2178759,China’s Got a New Plan to Seize the World’s Tech Crown From the U.S. By Bloomberg,0.017,0.929,0.054000000000000006,0.9749
2020-05-20,AAPL,https://www.investing.com/news/technology-news/applegoogle-contact-tracing-tech-launches-with-23-countries-seeking-access-2178433,"Apple-Google contact tracing tech draws interest in 23 countries, some hedge bets By Reuters",0.051,0.895,0.054000000000000006,0.359
2020-05-21,AAPL,https://www.investing.com/news/stock-market-news/japans-government-10-years-behind-on-tech-minister-says-2178870,"Japan’s Government 10 Years Behind on Tech, Minister Says By Bloomberg",0.043,0.9059999999999999,0.05,-0.1655
2020-05-21,AAPL,https://www.investing.com/news/technology-news/in-softbank-slides-tofu-a-goose-and-unicorns-underpin-sales-pitch-2179086,"In SoftBank slides, tofu, a goose and unicorns underpin sales pitch By Reuters",0.036000000000000004,0.873,0.092,0.9526
2020-05-21,AAPL,https://www.investing.com/news/technology-news/irish-regulator-questions-apple-over-recordings-2179676,Irish regulator questions Apple over recordings By Reuters,0.009000000000000001,0.9740000000000001,0.016,0.1764
2020-05-22,AAPL,https://www.investing.com/news/technology-news/us-strikes-at-a-huawei-prize-chip-juggernaut-hisilicon-2179976,U.S. strikes at a Huawei prize: chip juggernaut HiSilicon By Reuters,0.044000000000000004,0.889,0.066,0.9384
2020-05-22,AAPL,https://www.investing.com/news/technology-news/university-of-alabama-to-push-contact-tracing-app-require-online-health-checks-2180037,"University of Alabama System to push contact tracing app, require online health checks By Reuters",0.022000000000000002,0.941,0.037000000000000005,0.6124
2020-05-22,AAPL,https://www.investing.com/news/coronavirus/canada-to-ramp-up-covid19-testing-and-tracing-recommend-digital-app-2180815,"Canada to ramp up COVID-19 testing and tracing, recommend digital app By Reuters",0.040999999999999995,0.888,0.071,0.8652
2020-05-23,AAPL,https://www.investing.com/news/coronavirus/factbox-latest-on-the-worldwide-spread-of-the-coronavirus-2181232,Factbox: Latest on the worldwide spread of the coronavirus By Reuters,0.069,0.88,0.051,-0.9565
2020-05-25,AAPL,https://www.investing.com/news/coronavirus/latvia-to-launch-googleapple-friendly-coronavirus-contact-tracing-app-2181851,Latvia to launch Google-Apple friendly coronavirus contact tracing app By Reuters,0.027999999999999997,0.847,0.125,0.965
2020-05-26,AAPL,https://www.investing.com/news/technology-news/japans-marvelous-shares-untraded-as-chinas-tencent-takes-20-stake-2182227,Japan's Marvelous shares jump 17% as China's Tencent takes 20% stake By Reuters,0.018000000000000002,0.892,0.09,0.9442
2020-05-26,AAPL,https://www.investing.com/news/stock-market-news/apple-to-reopen-about-100-stores-in-us-most-with-curbside-pickup-2182986,"Apple to reopen about 100 U.S. stores, most with curbside pickup By Reuters",0.0,0.9259999999999999,0.07400000000000001,0.9578
2020-05-26,AAPL,https://www.investing.com/news/economy/rally-of-hope-why-the-sp-soared-back-past-3000-2183102,"'Rally of hope': Why the S&P soared back past 3,000 By Reuters",0.043,0.9059999999999999,0.051,0.4123
2020-05-26,AAPL,https://www.investing.com/news/technology-news/india-makes-source-code-of-contacttracing-app-public-2183208,India makes source code of contact-tracing app public By Reuters,0.004,0.932,0.064,0.9628
2020-05-26,AAPL,https://www.investing.com/news/stock-market-news/us-stocks-higher-at-close-of-trade-dow-jones-industrial-average-up-217-2183271,U.S. stocks higher at close of trade; Dow Jones Industrial Average up 2.17% By Investing.com,0.046,0.9009999999999999,0.054000000000000006,0.128
2020-05-26,AAPL,https://www.investing.com/news/cryptocurrency-news/was-satoshi-a-windows-or-mac-guy-we-have-the-answer-2183292,Was Satoshi a Windows or Mac Guy? We Have the Answer By Cointelegraph,0.028999999999999998,0.932,0.039,0.2263
2020-05-27,AAPL,https://www.investing.com/news/world-news/man-arrested-in-deadly-2019-fire-at-japans-kyoto-animation-media-2183397,Man arrested over deadly 2019 arson at Japan's Kyoto Animation By Reuters,0.204,0.778,0.018000000000000002,-0.9953
2020-05-27,AAPL,https://www.investing.com/news/technology-news/factbox-where-do-trump-and-biden-stand-on-tech-policy-issues-2184017,Factbox: Where do Trump and Biden stand on tech policy issues? By Reuters,0.064,0.871,0.065,0.0671
2020-05-27,AAPL,https://www.investing.com/news/technology-news/att-launches-hbo-max-vying-with-netflix-others-for-quarantine-viewing-2183635,"AT&T launches HBO Max, vying with Netflix, others for quarantine viewing By Reuters",0.043,0.875,0.083,0.9325
2020-05-27,AAPL,https://www.investing.com/news/stock-market-news/stocks--dow-jumps-as-financials-take-spotlight-amid-stumble-in-tech-2184249,Stocks - Wall Street Rides Financials Higher to Claw Back Losses By Investing.com,0.065,0.836,0.099,0.8519
2020-05-27,AAPL,https://www.investing.com/news/stock-market-news/dow-busts-move-higher-on-late-buying-as-traders-bank-on-financials-to-shine-2184456,Dow Busts Move Higher on Late Buying as Traders Bank on Financials to Shine By Investing.com,0.068,0.828,0.10400000000000001,0.8859999999999999
2020-05-28,AAPL,https://www.investing.com/news/world-news/trump-threatens-to-regulate-or-shut-down-social-media-companies-2183759,Trump to sign executive order on social media on Thursday: White House By Reuters,0.10400000000000001,0.846,0.05,-0.9852
2020-05-28,AAPL,https://www.investing.com/news/general/apple-secures-deal-for-scorseses-next-film-starring-dicaprio-de-niro-media-2184729,"Apple secures deal for Scorsese's next film starring DiCaprio, De Niro: media By Reuters",0.09,0.856,0.054000000000000006,-0.875
2020-05-28,AAPL,https://www.investing.com/news/coronavirus/alibaba-extends-its-reach-in-china-as-coronavirus-outbreak-opens-doors-2184841,Alibaba extends its reach in China as coronavirus outbreak opens doors By Reuters,0.05,0.872,0.078,0.9723
2020-05-28,AAPL,https://www.investing.com/news/world-news/musicians-in-lockdown-rage-against-industry-machine-2184967,Musicians in lockdown rage against industry machine By Reuters,0.036000000000000004,0.865,0.099,0.983
2020-05-29,AAPL,https://www.investing.com/news/roth-capital-stick-to-their-buy-rating-for-glu-mobile-2186535,Roth Capital Stick to Their Buy Rating for Glu Mobile By Investing.com,0.013999999999999999,0.897,0.08900000000000001,0.8779
2020-05-29,AAPL,https://www.investing.com/news/wedbush-stick-to-their-buy-rating-for-glu-mobile-2187011,Wedbush Stick to Their Buy Rating for Glu Mobile By Investing.com,0.013999999999999999,0.895,0.09,0.8779
2020-05-29,AAPL,https://www.investing.com/news/economy/feds-corporate-bond-facility-bought-15-etfs-in-first-days-of-operations-2187131,"In rescue effort, Fed has broad stake in corporate America's fortunes By Reuters",0.055999999999999994,0.8909999999999999,0.053,-0.6486
2020-05-31,AAPL,https://www.investing.com/news/technology-news/amazon-removes-racist-messages-after-they-appear-on-some-product-listings-2187627,Amazon removes racist messages after they appear on some product listings By Reuters,0.16399999999999998,0.735,0.10099999999999999,-0.9488
2020-06-01,AAPL,https://www.investing.com/news/coronavirus/retailers-already-hit-by-coronavirus-board-up-as-us-protests-rage-2187797,Retailers already hit by coronavirus board up as U.S. protests rage By Reuters,0.079,0.8590000000000001,0.062,-0.9169
2020-06-01,AAPL,https://www.investing.com/news/suntrust-robinson-stick-to-their-buy-rating-for-yext-inc-2188157,SunTrust Robinson Stick to Their Buy Rating for Yext Inc By Investing.com,0.013999999999999999,0.8759999999999999,0.11,0.9246
2020-06-01,AAPL,https://www.investing.com/news/wedbush-stick-to-their-buy-rating-for-zynga-2188635,Wedbush Stick to Their Buy Rating for Zynga By Investing.com,0.015,0.894,0.091,0.8779
2020-06-01,AAPL,https://www.investing.com/news/politics/factbox-where-do-trump-and-biden-stand-on-tech-policy-issues-2188708,Factbox: Where do Trump and Biden stand on tech policy issues? By Reuters,0.07200000000000001,0.861,0.067,-0.6586
2020-06-01,AAPL,https://www.investing.com/news/economy/lemon-or-not-trump-is-stuck-with-phase-1-china-trade-deal-2188098,"'Lemon' or not, Trump stuck with Phase 1 China trade deal for now By Reuters",0.075,0.7929999999999999,0.133,0.992
2020-06-01,AAPL,https://www.investing.com/news/coronavirus/italy-launches-covid19-contacttracing-app-amid-privacy-concerns-2188780,Italy launches COVID-19 contact-tracing app amid privacy concerns By Reuters,0.069,0.877,0.054000000000000006,-0.775
2020-06-02,AAPL,https://www.investing.com/news/oppenheimer-stick-to-their-buy-rating-for-zynga-2189135,Oppenheimer Stick to Their Buy Rating for Zynga By Investing.com,0.015,0.894,0.091,0.8779
2020-06-02,AAPL,https://www.investing.com/news/keybanc-stick-to-their-buy-rating-for-zynga-2189358,KeyBanc Stick to Their Buy Rating for Zynga By Investing.com,0.015,0.894,0.091,0.8779
2020-06-02,AAPL,https://www.investing.com/news/stock-market-news/eu-to-rule-on-amss-46-billion-euro-bid-for-osram-by-july-6-2189361,EU to rule on AMS's 4.6 billion euro bid for Osram by July 6 By Reuters,0.013000000000000001,0.935,0.052000000000000005,0.5994
2020-06-02,AAPL,https://www.investing.com/news/economy/top-5-things-to-know-in-the-market-on-tuesday-june-2nd-2189381,"Top 5 Things to Know in the Market on Tuesday, June 2nd By Investing.com",0.095,0.835,0.07,-0.9639
2020-06-02,AAPL,https://www.investing.com/news/stock-market-news/stocks--us-futures-higher-economic-optimism-overshadows-unrest-2189399,Stocks - U.S. Futures Higher; Economic Optimism Overshadows Unrest By Investing.com,0.1,0.867,0.033,-0.9867
2020-06-02,AAPL,https://www.investing.com/news/technology-news/with-rallies-halted-and-tweets-factchecked-trump-campaign-turns-to-smartphone-app-2189414,"With rallies halted and tweets fact-checked, Trump campaign turns to smartphone app By Reuters",0.038,0.871,0.09,0.9908
2020-06-02,AAPL,https://www.investing.com/news/stock-market-news/stocks--apple-starbucks-edge-lower-in-premarket-on-demand-concerns-2189584,"Stocks - Apple, Starbucks Edge Lower in Premarket on Demand Concerns By Investing.com",0.0,1.0,0.0,0.0
2020-06-02,AAPL,https://www.investing.com/news/stock-market-news/stocks--wall-street-opens-mixed-as-violent-protests-cloud-reopening-hopes-2189622,Stocks - Wall Street Opens Mixed as Violent Protests Cloud Reopening Hopes By Investing.com,0.10400000000000001,0.826,0.07,-0.8779
2020-06-02,AAPL,https://www.investing.com/news/technology-news/india-launches-67-billion-plan-to-boost-electronics-manufacturing-2189658,India launches $6.7 billion plan to boost electronics manufacturing By Reuters,0.0,0.9179999999999999,0.08199999999999999,0.9325
2020-06-02,AAPL,https://www.investing.com/news/morgan-stanley-stick-to-their-buy-rating-for-zynga-2189702,Morgan Stanley Stick to Their Buy Rating for Zynga By Investing.com,0.013999999999999999,0.895,0.09,0.8779
2020-06-02,AAPL,https://www.investing.com/news/cowen--co-stick-to-their-buy-rating-for-zynga-2189703,Cowen & Co. Stick to Their Buy Rating for Zynga By Investing.com,0.013999999999999999,0.895,0.09,0.8779
2020-06-02,AAPL,https://www.investing.com/news/credit-suisse-stick-to-their-sell-rating-for-zynga-2189954,Credit Suisse Stick to Their Sell Rating for Zynga By Investing.com,0.013999999999999999,0.863,0.12300000000000001,0.9359999999999999
