date,ticker,link,headline,neg,neu,pos,compound
2020-02-06,AAPL,https://www.investing.com/news/technology-news/eu-investigates-qualcomm-over-radiofrequency-chips-2077345,EU investigates Qualcomm over radio-frequency chips By Reuters,0.055,0.884,0.06,0.3071
2020-02-06,AAPL,https://www.investing.com/news/stock-market-news/apple-airpods-face-delay-due-to-coronavirus--report-2078228,Apple AirPods Face Delay Due to Coronavirus - Report By Investing.com,0.038,0.9309999999999999,0.031,0.0772
2020-02-06,AAPL,https://www.investing.com/news/technology-news/google-maps-seeks-business-transit-reviews-in-new-look-as-it-turns-15-2077700,"Google Maps seeks business, transit reviews in new look as it turns 15 By Reuters",0.0,0.879,0.121,0.9895
2020-02-06,AAPL,https://www.investing.com/news/stock-market-news/musk-needs-apples-margins-and-vws-sales-to-justify-tesla-value-2078524,Musk Needs Apple’s Margins and VW’s Sales to Justify Tesla Value By Bloomberg,0.021,0.9159999999999999,0.063,0.9787
2020-02-06,AAPL,https://www.investing.com/news/stock-market-news/us-stocks-higher-at-close-of-trade-dow-jones-industrial-average-up-030-2078591,U.S. stocks higher at close of trade; Dow Jones Industrial Average up 0.30% By Investing.com,0.055999999999999994,0.879,0.065,0.2732
2020-02-07,AAPL,https://www.investing.com/news/commodities-news/dozens-of-trade-fairs-conferences-postponed-amid-china-virus-fears-2077678,"Dozens of Asia trade fairs, conferences postponed amid coronavirus fears By Reuters",0.057999999999999996,0.884,0.057999999999999996,-0.1101
2020-02-07,AAPL,https://www.investing.com/news/stock-market-news/foxconn-chinese-firms-refit-production-lines-to-make-masks-amid-virus-outbreak-2078831,"Foxconn, Chinese firms refit production lines to make masks amid virus outbreak By Reuters",0.027999999999999997,0.958,0.013999999999999999,-0.6908
2020-02-07,AAPL,https://www.investing.com/news/stock-market-news/lifeblood-of-amazon-merchants-threatened-as-coronavirus-infects-chinese-workers-2078962,Lifeblood of Amazon merchants threatened as coronavirus infects Chinese workers By Reuters,0.053,0.856,0.091,0.9620000000000001
2020-02-07,AAPL,https://www.investing.com/news/general/us-hiring-surged-in-january-but-strength-in-doubt-2079374,U.S. hiring surged in January but strength in doubt By Reuters,0.047,0.847,0.105,0.9296
2020-02-07,AAPL,https://www.investing.com/news/general/fed-warns-of-possible-shock-from-coronavirus-2079553,Fed warns of possible shock from coronavirus By Reuters,0.114,0.8690000000000001,0.017,-0.9455
2020-02-07,AAPL,https://www.investing.com/news/stock-market-news/stock-slide-deepens-after-torrid-run-bonds-rise-markets-wrap-2079645,Stock Slide Deepens After Torrid Run; Bonds Rise: Markets Wrap By Bloomberg,0.111,0.779,0.11,-0.4854
2020-02-08,AAPL,https://www.investing.com/news/technology-news/apple-to-delay-reopening-of-retail-stores-in-china-2079706,Apple to delay reopening of retail stores in China By Reuters,0.0,0.971,0.028999999999999998,0.3818
2020-02-08,AAPL,https://www.investing.com/news/general/viacomcbs-to-launch-new-streaming-platform-cnbc-2078666,ViacomCBS to launch new streaming platform: source By Reuters,0.022000000000000002,0.9,0.079,0.935
2020-02-08,AAPL,https://www.investing.com/news/stock-market-news/as-china-returns-to-work-it-is-hardly-business-as-usual-2079809,"As China returns to work, it is hardly business as usual By Reuters",0.038,0.93,0.032,-0.2708
2020-02-09,AAPL,https://www.investing.com/news/cryptocurrency-news/faang-stocks-provide-a-better-riskadjusted-performance-than-bitcoin-2079933,FAANG Stocks Provide a Better Risk-Adjusted Performance Than Bitcoin By Cointelegraph,0.0,0.867,0.133,0.9398
2020-02-09,AAPL,https://www.investing.com/news/economy/chinas-shenzhen-says-foxconn-to-resume-operations-after-inspections-2080025,China's Shenzhen denies blocking Apple supplier Foxconn from resuming production By Reuters,0.049,0.912,0.039,-0.8763
2020-02-10,AAPL,https://www.investing.com/news/economy/nightmare-for-global-tech-coronavirus-fallout-just-beginning-2080235,‘Nightmare’ for Global Tech: Coronavirus Fallout Just Beginning By Bloomberg,0.07400000000000001,0.8740000000000001,0.052000000000000005,-0.9909
2020-02-10,AAPL,https://www.investing.com/news/general/japan-cruise-reported-to-have-60-more-infections-virus-update-2080236,Japan Cruise Reported to Have 60 More Infections: Virus Update By Bloomberg,0.054000000000000006,0.892,0.054000000000000006,-0.7111
2020-02-10,AAPL,https://www.investing.com/news/forex-news/asian-stocks-slip-yuan-fluctuates-on-virus-news-markets-wrap-2080242,"Asian Stocks Slip, Yuan Fluctuates on Virus News: Markets Wrap By Bloomberg",0.028999999999999998,0.917,0.054000000000000006,0.4939
2020-02-10,AAPL,https://www.investing.com/news/economy/deaths-hit-910-global-firms-restart-china-plants-virus-update-2080241,Deaths Hit 910; Global Firms Restart China Plants: Virus Update By Bloomberg,0.055,0.892,0.053,-0.8002
2020-02-10,AAPL,https://www.investing.com/news/stock-market-news/nightmare-for-global-tech-virus-fallout-is-just-beginning-2080310,‘Nightmare’ for Global Tech: Virus Fallout is Just Beginning By Bloomberg,0.07200000000000001,0.8759999999999999,0.052000000000000005,-0.9895
2020-02-10,AAPL,https://www.investing.com/news/technology-news/researcher-sees-global-smartphone-output-at-fiveyear-low-due-to-virus-2080327,Researcher sees global smartphone output at five-year low due to virus By Reuters,0.071,0.929,0.0,-0.3818
2020-02-10,AAPL,https://www.investing.com/news/technology-news/chinas-firstquarter-smartphone-sales-may-halve-due-to-coronavirus-analysts-2080311,China's first-quarter smartphone sales may halve due to coronavirus: analysts By Reuters,0.039,0.905,0.055999999999999994,0.8294
2020-02-10,AAPL,https://www.investing.com/news/stock-market-news/stocks--futures-point-to-small-gains-virus-breeds-uncertainty-2080411,Stocks - Futures Point to Small Gains; Virus Breeds Uncertainty By Investing.com,0.085,0.87,0.045,-0.9718
2020-02-10,AAPL,https://www.investing.com/news/stock-market-news/foxconn-delays-return-of-workers-to-main-china-iphone-plants-2080476,Foxconn Delays Return of Workers to Main China iPhone Plants By Bloomberg,0.05,0.915,0.035,-0.3563
2020-02-10,AAPL,https://www.investing.com/news/technology-news/taiwans-foxconn-gets-ok-to-restart-plant-in-zhengzhou-china-source-2080189,Top Apple iPhone maker Foxconn restarts key China plant with 10% of workers: source By Reuters,0.040999999999999995,0.922,0.037000000000000005,-0.517
2020-02-10,AAPL,https://www.investing.com/news/stock-market-news/stocks--taubman-soars-in-premarket-on-simon-bid-xerox-raises-hp-offer-2080564,Stocks - Taubman Soars in Premarket on Simon Bid; Xerox Raises HP Offer By Investing.com,0.0,0.867,0.133,0.3182
2020-02-10,AAPL,https://www.investing.com/news/technology-news/softbankowned-arm-to-launch-new-ai-chip-for-small-devices-2080574,SoftBank-owned Arm to launch new AI chip for small devices By Reuters,0.018000000000000002,0.898,0.084,0.9617
2020-02-10,AAPL,https://www.investing.com/news/stock-market-news/stocks--wall-street-drifts-lower-at-open-virus-delays-china-restart-2080672,Stocks - Wall Street Drifts Lower at Open; Virus Delays China Restart By Investing.com,0.08199999999999999,0.85,0.068,-0.6966
2020-02-10,AAPL,https://www.investing.com/news/stock-market-news/foxconn-resumes-some-production-at-its-main-china-iphone-site-2080932,Foxconn Resumes Some Production at Its Main China IPhone Site By Bloomberg,0.043,0.917,0.039,0.0557
2020-02-10,AAPL,https://www.investing.com/news/stock-market-news/foxconn-resumes-some-production-at-its-main-china-iphone-site-2080931,Foxconn Resumes Some Production at Its Main China IPhone Site By Bloomberg,0.043,0.917,0.039,0.0557
2020-02-10,AAPL,https://www.investing.com/news/economy/austrias-ams-aims-for-domination-agreement-with-osram-2080948,Austria's AMS aims for domination agreement with Osram By Reuters,0.064,0.746,0.19,0.9889
2020-02-10,AAPL,https://www.investing.com/news/stock-market-news/nasdaq-hits-new-high-as-investors-look-beyond-coronavirus-2080464,"S&P 500, Nasdaq reach record closing highs; Chinese workers return By Reuters",0.035,0.883,0.08199999999999999,0.9674
2020-02-10,AAPL,https://www.investing.com/news/stock-market-news/us-stocks-hit-record-despite-coronavirus-fears-markets-wrap-2081037,U.S. Stocks Hit Record Despite Coronavirus Fears: Markets Wrap By Bloomberg,0.048,0.867,0.086,0.8797
2020-02-11,AAPL,https://www.investing.com/news/stock-market-news/us-appeals-court-denies-apple-bid-for-rehearing-in-virnetx-patent-case-2080875,U.S. appeals court denies Apple bid for rehearing in VirnetX patent case By Reuters,0.046,0.9359999999999999,0.018000000000000002,-0.4019
2020-02-11,AAPL,https://www.investing.com/news/technology-news/samsung-to-unveil-squareshaped-foldable-phones-to-challenge-apple-2081267,Samsung to unveil square-shaped foldable phones to challenge Apple By Reuters,0.035,0.8809999999999999,0.085,0.8985
2020-02-11,AAPL,https://www.investing.com/news/general/deaths-tops-1000-us-confirms-13th-infection-virus-update-2081296,"Deaths Tops 1,000; U.S. Confirms 13th Infection: Virus Update By Bloomberg",0.099,0.862,0.039,-0.9993
2020-02-11,AAPL,https://www.investing.com/news/technology-news/demand-for-streaming-tv-services-remains-strong-nielsen-survey-suggests-2081412,"Demand for streaming TV services remains strong, Nielsen survey suggests By Reuters",0.013999999999999999,0.9420000000000001,0.044000000000000004,0.6901
2020-02-11,AAPL,https://www.investing.com/news/technology-news/ams-tops-fourthquarter-revenue-forecast-sees-lower-sales-in-firstquarter-2081308,"AMS tops fourth-quarter revenue forecast, sees sales slowing even without coronavirus By Reuters",0.085,0.8290000000000001,0.085,0.2603
2020-02-11,AAPL,https://www.investing.com/news/technology-news/bluemail-says-excluded-app-returns-to-mac-app-store-2081917,BlueMail says excluded app returns to Mac app store By Reuters,0.047,0.904,0.048,0.128
2020-02-11,AAPL,https://www.investing.com/news/stock-market-news/breaking-ftc-to-look-into-large-tech-acquisitions-2081943,Breaking: FTC to Look Into Large Tech Acquisitions By Investing.com,0.0,0.899,0.10099999999999999,0.9079999999999999
2020-02-11,AAPL,https://www.investing.com/news/technology-news/driver-in-fatal-2018-tesla-crash-reported-prior-autopilot-issue-2081881,Tesla driver in fatal crash had reported problems before with 'Autopilot' feature By Reuters,0.09300000000000001,0.8759999999999999,0.031,-0.9709
2020-02-11,AAPL,https://www.investing.com/news/technology-news/apple-hires-warner-music-veteran-to-oversee-music-initiatives-2082005,Apple hires Warner Music veteran for business development at streaming unit By Reuters,0.0,0.9540000000000001,0.046,0.4404
2020-02-11,AAPL,https://www.investing.com/news/stock-market-news/stocks--sp-nasdaq-notch-another-record-close-despite-late-stumble-in-tech-2082180,"Stocks - S&P, Nasdaq Notch Another Record Close Despite Late Stumble in Tech By Investing.com",0.096,0.8220000000000001,0.081,-0.8175
2020-02-11,AAPL,https://www.investing.com/news/technology-news/akamai-revenue-beats-estimates-on-cloud-growth-2082181,Akamai revenue beats estimates on cloud growth By Reuters,0.031,0.804,0.165,0.9764
2020-02-11,AAPL,https://www.investing.com/news/stock-market-news/ftc-demands-data-about-acquisitions-from-google-amazoncom-apple-facebook-and-microsoft-2081935,"FTC demands data on small buys by Google, Amazon, Apple, Facebook, Microsoft By Reuters",0.031,0.87,0.099,0.9926
2020-02-12,AAPL,https://www.investing.com/news/general/samsung-unveils-its-new-foldable-galaxy-z-phone-2082358,Samsung unveils its new foldable Galaxy Z phone By Reuters,0.027000000000000003,0.843,0.13,0.9828
2020-02-12,AAPL,https://www.investing.com/news/technology-news/foxconn-aims-to-resume-half-china-production-by-endfebruary-source-2082412,Foxconn aims to resume half of output in virus-hit China by month-end: source By Reuters,0.064,0.872,0.064,0.0046
2020-02-12,AAPL,https://www.investing.com/news/stock-market-news/stocks--wall-street-hits-new-records-at-open-on-virus-hopes-2082976,Stocks - Wall Street Hits New Records at Open on Virus Hopes By Investing.com,0.051,0.873,0.076,0.7999
2020-02-12,AAPL,https://www.investing.com/news/technology-news/eu-antitrust-regulators-plan-broad-enquiry-into-tech-sector-2083126,EU antitrust regulators plan broad enquiry into tech sector By Reuters,0.053,0.853,0.094,0.7659999999999999
2020-02-13,AAPL,https://www.investing.com/news/technology-news/foxconn-says-recent-reuters-reports-on-factory-resumption-in-china-were-not-factual-2083560,Foxconn says recent Reuters reports on factory resumption in China were not factual By Reuters,0.015,0.963,0.022000000000000002,0.1779
2020-02-13,AAPL,https://www.investing.com/news/cryptocurrency-news/china-takes-additional-steps-to-digitise-the-renminbi-2083650,China takes additional steps to digitise the renminbi By Cointelegraph,0.01,0.898,0.092,0.8714
2020-02-13,AAPL,https://www.investing.com/news/technology-news/broadcom-targets-choppy-audio-with-new-bluetooth-chip-2083776,Broadcom targets choppy audio with new Bluetooth chip By Reuters,0.0,0.9259999999999999,0.07400000000000001,0.9432
2020-02-13,AAPL,https://www.investing.com/news/stock-market-news/apple-to-reopen-some-stores-in-beijing-on-february-14-website-2083973,Apple to reopen some stores in Beijing on February 14: website By Reuters,0.054000000000000006,0.946,0.0,-0.8683
2020-02-13,AAPL,https://www.investing.com/news/stock-market-news/stocks--tesla-cisco-mgm-all-fall-in-premarket-2084027,"Stocks - Tesla, Cisco, MGM All Fall in Premarket By Investing.com",0.0,0.887,0.113,0.3182
2020-02-13,AAPL,https://www.investing.com/news/stock-market-news/qualcomm-to-ask-appeals-court-for-vindication-in-ftc-antitrust-case-2083972,FTC antitrust victory on Qualcomm questioned by appeals court By Reuters,0.099,0.821,0.081,-0.6327
2020-02-13,AAPL,https://www.investing.com/news/technology-news/roku-holiday-quarter-revenue-beats-on-new-streaming-platforms-2084580,"New streaming launches power Roku's holiday sales, forecast By Reuters",0.036000000000000004,0.8370000000000001,0.127,0.9872
2020-02-14,AAPL,https://www.investing.com/news/technology-news/british-network-three-joins-5g-mobile-club-2084772,British network Three joins 5G mobile club By Reuters,0.047,0.902,0.051,0.25
2020-02-14,AAPL,https://www.investing.com/news/stock-market-news/apple-to-reopen-a-store-in-shanghai-on-february-15-2085625,Apple to reopen a store in Shanghai on February 15 By Reuters,0.035,0.965,0.0,-0.4939
2020-02-14,AAPL,https://www.investing.com/news/technology-news/bridgewater-viking-among-big-hedge-funds-that-added-tesla-in-fourth-quarter-before-rally-2085664,"Bridgewater, Viking among big hedge funds that added Tesla in fourth quarter before rally By Reuters",0.0,0.897,0.10300000000000001,0.9670000000000001
2020-02-15,AAPL,https://www.investing.com/news/stock-market-news/buffetts-berkshire-buys-kroger-and-biogen-reduces-wells-fargo-and-goldman-stakes-2085795,"Buffett's Berkshire buys Kroger and Biogen, reduces Wells Fargo and Goldman stakes By Reuters",0.048,0.847,0.105,0.9479
2020-02-16,AAPL,https://www.investing.com/news/stock-market-news/regulators-should-allow-rtl-and-prosieben-to-merge--rabe-2086131,Regulators should allow RTL and ProSieben to merge: Rabe By Reuters,0.022000000000000002,0.9129999999999999,0.065,0.9201
2020-02-18,AAPL,https://www.investing.com/news/forex-news/euro-edges-lower-on-economic-pessimism-aussie-hit-by-rate-outlook-2086790,"Euro edges lower on economic pessimism, Aussie hit by rate outlook By Reuters",0.086,0.825,0.09,0.3967
2020-02-18,AAPL,https://www.investing.com/news/technology-news/samsung-offers-phone-delivery-service-for-test-use-to-ride-out-coronavirus-impact-2086814,Samsung offers phone delivery service for test use to ride out coronavirus impact By Reuters,0.055999999999999994,0.909,0.034,-0.8622
2020-02-18,AAPL,https://www.investing.com/news/stock-market-news/asian-markets-fall-hang-seng-nikkei-down-more-than-1-on-apples-revenue-warning-2086822,"Asian Markets Fall; Hang Seng, Nikkei Down More Than 1% on Apple’s Revenue Warning By Investing.com",0.10099999999999999,0.872,0.026000000000000002,-0.946
2020-02-18,AAPL,https://www.investing.com/news/stock-market-news/apple-warns-sales-to-fall-short-of-target-due-to-coronavirus-impact-2086721,Apple warns sales to fall short of target due to coronavirus impact By Reuters,0.086,0.853,0.061,-0.9335
2020-02-18,AAPL,https://www.investing.com/news/commodities-news/oil-prices-slip-as-coronavirus-concerns-linger-2086799,Oil prices fall as market weighs coronavirus demand impact By Reuters,0.11699999999999999,0.8079999999999999,0.075,-0.9361
2020-02-18,AAPL,https://www.investing.com/news/forex-news/gold-prices-rebound-as-asian-stocks-fall-sinous-trade-news-in-focus-2086856,Gold Prices Rebound as Asian Stocks Fall; Sino-U.S. Trade News in Focus By Investing.com,0.04,0.8690000000000001,0.091,0.7184
2020-02-18,AAPL,https://www.investing.com/news/technology-news/samsung-poised-to-benefit-from-china-virus-woes-afflicting-apple-other-rivals-2086857,"Samsung poised to benefit from China virus woes afflicting Apple, other rivals By Reuters",0.068,0.857,0.07400000000000001,0.8658
2020-02-18,AAPL,https://www.investing.com/news/stock-market-news/investors-track-ships-chase-rumors-to-get-edge-on-covid19-risks-2086859,"Investors track ships, chase rumors to get edge on COVID-19 risks By Reuters",0.04,0.9159999999999999,0.044000000000000004,0.2357
2020-02-18,AAPL,https://www.investing.com/news/stock-market-news/stocks-fall-after-apple-warns-on-coronavirus-impact-2086792,Stocks under pressure as Apple sounds warning on coronavirus By Reuters,0.087,0.8340000000000001,0.079,-0.8506
2020-02-18,AAPL,https://www.investing.com/news/stock-market-news/stocks--europe-seen-lower-apple-and-hsbc-weigh-heavily-2086881,Stocks - Europe Seen Lower; Apple and HSBC Weigh Heavily By Investing.com,0.09300000000000001,0.841,0.066,-0.7935
2020-02-18,AAPL,https://www.investing.com/news/stock-market-news/softbank-spends-25-billion-to-get-second-vision-fund-off-the-ground-sources-2086887,SoftBank spends $2.5 billion to get second Vision Fund off the ground: sources By Reuters,0.042,0.8270000000000001,0.131,0.996
2020-02-18,AAPL,https://www.investing.com/news/stock-market-news/stocks--europe-dragged-lower-by-apple-warning-hsbc-losses-2086919,"Stocks - Europe Dragged Lower by Apple Warning, HSBC Losses By Investing.com",0.077,0.8390000000000001,0.083,0.7783
2020-02-18,AAPL,https://www.investing.com/news/economy/singapore-unveils-multibillion-dollar-package-to-weather-virus-2086893,Singapore plans biggest budget deficit in years to meet virus threat By Reuters,0.057,0.904,0.039,-0.8717
2020-02-18,AAPL,https://www.investing.com/news/stock-market-news/european-shares-slump-as-apple-warning-hammers-tech-sector-2086911,European shares slump as Apple warning hammers China-reliant sectors By Reuters,0.067,0.84,0.09300000000000001,0.8271
2020-02-18,AAPL,https://www.investing.com/news/stock-market-news/stockbeat--thyssenkrupp-takes-the-safest-route-to-survival-2086983,StockBeat:  ThyssenKrupp Takes the Safest Route to Survival By Investing.com,0.057999999999999996,0.879,0.063,0.1689
2020-02-18,AAPL,https://www.investing.com/news/stock-market-news/if-apple-is-hurting-due-to-the-coronavirus-its-suppliers-and-rivals-likely-are-too-2086960,"If Apple is hurting due to the coronavirus, its suppliers and rivals likely are too By Reuters",0.048,0.912,0.040999999999999995,-0.7102
2020-02-18,AAPL,https://www.investing.com/news/economy/top-5-things-to-know-in-the-market-on-tuesday-february-18th-2087037,"Top 5 Things to Know in the Market on Tuesday, February 18th By Investing.com",0.09,0.845,0.064,-0.9706
2020-02-18,AAPL,https://www.investing.com/news/commodities-news/oil-snaps-fiveday-rally-as-virus-continues-to-weigh-on-demand-2087059,Oil Snaps Five-Day Rally as Virus Continues to Weigh on Demand By Bloomberg,0.098,0.8420000000000001,0.06,-0.8074
2020-02-18,AAPL,https://www.investing.com/news/stock-market-news/stocks--us-futures-point-lower-apple-warning--weighs-walmart-misses-2087072,"Stocks - U.S. Futures Point Lower; Apple Warning  Weighs, Walmart Misses By Investing.com",0.094,0.872,0.034,-0.9714
2020-02-18,AAPL,https://www.investing.com/news/technology-news/exclusive-samsung-wins-5nanometer-modem-chip-contract-from-qualcomm--sources-2087143,Exclusive: Samsung wins 5-nanometer modem chip contract from Qualcomm - sources By Reuters,0.005,0.9209999999999999,0.07400000000000001,0.9819
2020-02-18,AAPL,https://www.investing.com/news/stock-market-news/bank-of-americafinds-fund-managers-slashing-growth-outlook-on-virus-woes-2087257,Bank of America Finds Fund Managers Slashing Growth Outlook on Virus Woes By Bloomberg,0.071,0.825,0.10300000000000001,0.6815
2020-02-18,AAPL,https://www.investing.com/news/stock-market-news/stocks--apple-falls-in-premarket-deal-boosts-legg-mason-franklin-2087254,"Stocks - Apple Falls in Premarket, Deal Boosts Legg Mason, Franklin By Investing.com",0.0,1.0,0.0,0.0
2020-02-18,AAPL,https://www.investing.com/news/stock-market-news/20-years-after-dotcom-peak-tech-dominance-keeps-investors-on-edge-2087122,"20 years after dot-com peak, tech dominance keeps investors on edge By Reuters",0.057,0.871,0.07200000000000001,0.855
2020-02-18,AAPL,https://www.investing.com/news/economy/head-of-hospital-dies-in-coronavirus-epicenter-global-economic-impact-spreads-2086795,China sees fall in coronavirus deaths but WHO urges caution By Reuters,0.106,0.843,0.051,-0.9924
2020-02-18,AAPL,https://www.investing.com/news/stock-market-news/stocks--wall-street-opens-lower-as-apple-warns-of-virus-hit-2087331,Stocks - Wall Street Opens Lower as Apple Warns of Virus Hit By Investing.com,0.10800000000000001,0.83,0.062,-0.9629
2020-02-18,AAPL,https://www.investing.com/news/commodities-news/gold-futures-hit-1600-as-apple-warning-rocks-risk-assets-2087397,"Gold Futures Hit $1,600 as Apple Warning Rocks Risk Assets By Investing.com",0.096,0.8290000000000001,0.075,-0.722
2020-02-18,AAPL,https://www.investing.com/news/stock-market-news/jaguar-land-rover-to-run-out-of-chinese-parts-for-uk-production-after-two-weeks-ceo-2087329,Jaguar Land Rover's UK output at risk from coronavirus-hit supplies By Reuters,0.048,0.89,0.061,0.4791
2020-02-18,AAPL,https://www.investing.com/news/technology-news/us-mulls-cutting-huawei-off-from-global-chip-suppliers-with-tsmc-in-crosshairs-2086726,"U.S. mulls cutting Huawei off from global chip suppliers, with TSMC in crosshairs By Reuters",0.102,0.7959999999999999,0.102,-0.7776
2020-02-18,AAPL,https://www.investing.com/news/stock-market-news/stocks--wall-street-falls-as-apples-revenue-warning-flags-fresh-virus-fears-2087577,Stocks - Wall Street Falls as Apple's Revenue Warning Flags Fresh Virus Fears By Investing.com,0.099,0.853,0.048,-0.9317
2020-02-18,AAPL,https://www.investing.com/news/stock-market-news/apple-warning-boosts-trade-in-chipheavy-fund-to-twoyear-high-2087578,Apple Warning Boosts Trade in Chip-Heavy Fund to Two-Year High By Bloomberg,0.07400000000000001,0.852,0.075,0.1517
2020-02-18,AAPL,https://www.investing.com/news/stock-market-news/virgin-galactics-stock-soars-fueled-by-retail-investors-2087640,"Virgin Galactic's stock soars, fueled by retail investors By Reuters",0.008,0.868,0.124,0.993
2020-02-18,AAPL,https://www.investing.com/news/technology-news/apple-may-miss-mass-production-schedule-for-new-cheaper-iphone--nikkei-2087609,"Apple may miss mass production schedule for new, cheaper iPhone: Nikkei By Reuters",0.044000000000000004,0.9279999999999999,0.027999999999999997,0.0129
2020-02-18,AAPL,https://www.investing.com/news/commodities-news/gold-rides-apple-warning-to-reclaim-1600-2087705,"Gold Rides Apple Warning to Reclaim $1,600 By Investing.com",0.08199999999999999,0.838,0.08,0.0772
2020-02-18,AAPL,https://www.investing.com/news/stock-market-news/stocks-mixed-with-apple-forecast-spurring-caution-markets-wrap-2087757,Stocks Mixed With Apple Forecast Spurring Caution: Markets Wrap By Bloomberg,0.066,0.888,0.046,-0.578
2020-02-18,AAPL,https://www.investing.com/news/stock-market-news/stocks--nasdaq-ekes-out-gain-as-apple-cuts-some-losses-on-bets-of-rebound-2087740,Stocks - Nasdaq Ekes out Gain as Apple Cuts Some Losses on Bets of Rebound By Investing.com,0.132,0.8009999999999999,0.067,-0.9313
2020-02-18,AAPL,https://www.investing.com/news/stock-market-news/apples-surprise-sales-warning-pressures-wall-street-2087168,"Dow, S&P 500 decline after Apple's sales warning By Reuters",0.075,0.8170000000000001,0.10800000000000001,0.9578
2020-02-18,AAPL,https://www.investing.com/news/stock-market-news/us-stocks-mixed-at-close-of-trade-dow-jones-industrial-average-down-056-2087806,U.S. stocks mixed at close of trade; Dow Jones Industrial Average down 0.56% By Investing.com,0.068,0.885,0.047,-0.8979
2020-02-18,AAPL,https://www.investing.com/news/technology-news/coronavirus-threatens-apple-supply-chain-sales-shares-drop-2087269,"Coronavirus threatens Apple supply chain, sales; shares drop By Reuters",0.033,0.907,0.06,0.9081
2020-02-19,AAPL,https://www.investing.com/news/forex-news/dollar-shines-against-euro-riskier-peers-as-virus-hit-widens-2087942,"Dollar shines against euro, riskier peers as virus hit widens By Reuters",0.077,0.892,0.031,-0.9508
2020-02-19,AAPL,https://www.investing.com/news/commodities-news/gold-tops-1600-as-virus-fuels-growth-fears-2088015,"Gold Tops $1,600 as Virus Fuels Growth Fears By Bloomberg",0.086,0.845,0.069,-0.743
2020-02-19,AAPL,https://www.investing.com/news/stock-market-news/asia-stocks-rise-on-lull-in-virus-worry-euro-still-weak-2087931,"China stimulus hints, slowing spread of virus lift stocks By Reuters",0.125,0.7829999999999999,0.092,-0.9674
